id_projeto_pesquisa,codigo_projeto,titulo,palavras_chave,id_projeto,ano,data_inicio,data_fim,situacao,tipo_projeto,categoria_projeto,id_unidade,unidade,id_coordenador,coordenador,edital,id_grupo_pesquisa,grupo_pesquisa,linha_pesquisa,area_conhecimento_cnpq,objetivos_desenvolvimento_sustentavel
85137918,PVG7224-2011,Utilização de Processamento de Imagens para Monitoramento de Reservatório de Petróleo e Gás,"processamento de imagens, computação, petróleo",85137916,2011,2011/08/01 00:00:00.000,2012/07/31 00:00:00.000,FINALIZADO,INTERNO,Pesquisa Científica,56,departamento de engenharia de computacao e automacao,,,(2011) Edital PIBIC/PIBIC-AA/PIBITI-2011-2012,155.0,ROBÓTICA E SISTEMAS DEDICADOS,robótica e visão computacional,processamento gráfico (graphics),
88074107,PVG7414-2011,"Open-PACS (Open Picture Archiving and Communication System): Uma solução baseada em software livre para armazenamento, comunicação, processamento de imagens médicas como emissão de laudos a distância","pacs, imagem médica, laudagem remota, telemedicina",88074075,2011,2011/08/01 00:00:00.000,2013/09/02 00:00:00.000,FINALIZADO,EXTERNO,Pesquisa Tecnológica,5205,departamento de engenharia biomedica,,,,85199087.0,Laboratório de Inovação Tecnológica em Saúde,gestão e informática na saúde ,transdutores para aplicações biomédicas,
88672513,PVG7514-2011,Processamento Inteligente de Sinais Aplicado a Sistemas OFDM e CDMA,"equalização adaptativa, modulação adaptativa, antenas adaptativas, redes neurais artificiais, lógica fuzzy, algoritmos genéticos, comunicação digital, sistemas inteligentes, modulação digital, espalhamento espectral, cdma, ofdm, wireless, tv digital",88672511,2011,2012/03/01 00:00:00.000,2014/02/28 00:00:00.000,FINALIZADO,EXTERNO,Pesquisa Científica,56,departamento de engenharia de computacao e automacao,,,,20.0,SISTEMAS INTELIGENTES,redes neurais;processamento de sinais;processamento inteligente de informações;processamento de imagens,telecomunicações,
88685698,PVG7547-2011,"Análise e Otimização de Antenas Planares sobre Substratos Ferrimagnéticos, Ferroelétricos e Metamateriais Utilizando Inteligência Computacional","antenas de microfita, metamaterial, ferritas, ferroeletricos, redes neurais, algoritmos genéticos",88685694,2011,2012/01/01 00:00:00.000,2014/01/01 00:00:00.000,FINALIZADO,EXTERNO,Pesquisa Tecnológica,5204,departamento de engenharia de comunicações,,,,16.0,GRUPO DE MICROONDAS E ANTENAS,"antenas, microondas",telecomunicações,
88875508,PVG7715-2011,Benchmark de Algoritmos de Sistemas Lineares de Grande Escala Aplicados ao Método dos Elementos Finitos,"sistemas lineares, algoritmos, programação, otimização, elementos finitos, álgebra linear computacional",88875504,2011,2012/01/01 00:00:00.000,2012/12/31 00:00:00.000,RENOVADO,INTERNO,Pesquisa Científica,50,departamento de engenharia mecanica,,,(2012) Edital PROPESQ No. 05/2011_Distribuição de Bolsas de Iniciação Científica (IC) e Desenvolvimento Tecnológico e Inovação (IT) nas modalidades PROPESQ e REUNI,86805779.0,Otimização e controle de sistemas dinâmicos,otimização e álgebra linear computacional,métodos de síntese e otimização aplicados ao projeto mecânico,
89324342,PVG8893-2011,Projeto de Conclusão do SKINPID,"controle pid, desenvolvimento de software",89324339,2011,2011/12/15 00:00:00.000,2012/06/15 00:00:00.000,EM EXECUÇÃO,EXTERNO,Pesquisa Tecnológica,93,coordenação do curso engenharia de computação,,,,18.0,CONTROLE E ACIONAMENTO DE SISTEMAS,sistemas de controle;controle inteligente;otmização;controle de processos industriais,automação eletrônica de processos elétricos e industriais,
84992939,PVH6878-2011,Composição musical baseada em ativação de populações de neurônios do córtex sensorial primário,"composição musical, computação, música, neurociências",84992911,2011,2011/08/01 00:00:00.000,2013/07/31 00:00:00.000,EM EXECUÇÃO,INTERNO,Pesquisa Científica,284,escola de música,,,(2011) Edital PIBIC/PIBIC-AA/PIBITI-2011-2012,,,nan,composição musical,
88673108,PVH7516-2011,Orquestra Neural: Composição musical baseada em ativação de populações de neurônios do córtex sensorial primário,"composição musical, cross domain mapping, neurociências, música, computação",88673106,2011,2012/01/01 00:00:00.000,2012/12/31 00:00:00.000,RENOVADO,INTERNO,Pesquisa Científica,284,escola de música,,,(2012) Edital PROPESQ No. 05/2011_Distribuição de Bolsas de Iniciação Científica (IC) e Desenvolvimento Tecnológico e Inovação (IT) nas modalidades PROPESQ e REUNI,9532260.0,GRUMUS,processos criativos e práticas interpretativas,composição musical,
88905534,PVH7805-2011,"J-Syncker: Elaboração de um Aplicativo para Geração de Material Pré-Composicional baseado em uma Interpretação Computacional do ""Sistema Schillinger de Composição Musical"" ","algoritmos, composição musical, java, joseph schillinger, programação",88905532,2011,2012/01/01 00:00:00.000,2012/12/31 00:00:00.000,EM EXECUÇÃO,INTERNO,Pesquisa Científica,284,escola de música,,,(2012) Edital PROPESQ No. 05/2011_Distribuição de Bolsas de Iniciação Científica (IC) e Desenvolvimento Tecnológico e Inovação (IT) nas modalidades PROPESQ e REUNI,,,nan,composição musical,
84832544,PVJ6079-2011,Modelo de simulação para análise da cadeia produtiva do biodiesel,"pesquisa operacional, logistica, inteligencia artificial",84832532,2011,2011/08/01 00:00:00.000,2012/07/31 00:00:00.000,FINALIZADO,INTERNO,Pesquisa Científica,4885,escola de ciências e tecnologia,,,(2011) Edital PIBIC/PIBIC-AA/PIBITI-2011-2012,4821574.0,NAGI - Núcleo Aplicado à Gestão & Inovação,sistemas de apoio a decisão,"programação linear, não-linear, mista e dinâmica",
85112314,PVJ6555-2011,SAVIA - Sistema de autoria de video-aulas interativas & aumentadas,"educação a distância, realidade virtual, realidade aumentada",85112289,2011,2011/08/01 00:00:00.000,2012/07/31 00:00:00.000,RENOVADO,INTERNO,Pesquisa Científica,4885,escola de ciências e tecnologia,,,(2011) Edital PIBIC/PIBIC-AA/PIBITI-2011-2012,2050913.0,Laboratórios Associados Natalnet,realidade virtual,arquitetura de sistemas de computação,
88928559,PVJ7861-2011,Muse - Um sistema de criação automatizada de museus virtuais 2D e 3D,"ambientes virtuais; sistemas web; modelagem 3d, realidade virtual.",88928557,2011,2012/01/01 00:00:00.000,2012/12/31 00:00:00.000,RENOVADO,INTERNO,Pesquisa Científica,4885,escola de ciências e tecnologia,,,(2012) Edital PROPESQ No. 05/2011_Distribuição de Bolsas de Iniciação Científica (IC) e Desenvolvimento Tecnológico e Inovação (IT) nas modalidades PROPESQ e REUNI,2050913.0,Laboratórios Associados Natalnet,processamento grafico,arquitetura de sistemas de computação,
89199395,PVJ7918-2011,Memorial Virtual do Ministério Público do RN: Construção do Ambiente Tridimensional Colaborativo,"ambientes virtuais colaborativos, realidade virtual, memorial",89199393,2011,2011/11/18 00:00:00.000,2012/12/31 00:00:00.000,FINALIZADO,EXTERNO,Pesquisa Tecnológica,4885,escola de ciências e tecnologia,,,,2050913.0,Laboratórios Associados Natalnet,ambientes virtuais colaborativos,arquitetura de sistemas de computação,
89029065,PVL7897-2011,Investigação e teste de técnicas alternativas de refrigeração e proteção contra oxidação de placas eletrônicas instaladas em ambientes rurais inóspitos,"hardware, refrigeração, oxidação, ciências agrárias",89029063,2011,2012/02/01 00:00:00.000,2013/01/31 00:00:00.000,RENOVADO,INTERNO,Pesquisa Tecnológica,351,escola agrícola de jundiaí,,,(2012) Edital PROPESQ No. 07/2011 - Distribuição de Bolsas do Programa Institucional de Bolsas de Iniciação Científica para o Ensino Médio e Profissional (PIBIC-EM) da UFRN - Processo Seletivo 2012-2013,15492760.0,TECNOLOGIAS APLICADAS ÀS CIÊNCIAS AGRÁRIAS,informática aplicada à agricultura e automação agrícola,hardware,
2092917,PIB1952-2010," Implantação de uma Sala de Treinamento em Modelagem 3D e Up-Grade da Sala de Visualização  Nó UFRN 
","computação científica, visualização 3d , realidade virtual",2092883,2010,2010/05/24 00:00:00.000,2011/05/24 00:00:00.000,EM EXECUÇÃO,EXTERNO,Pesquisa Científica,120,departamento de matemática,,,,,,"computação científica, visualização 3d , realidade virtual",análise numérica,
2236439,PIB4903-2010,CTIC SoC-SBTVD,"sistemas embarcados, sistemas em chip, sbtvd, microeletrônica",2236437,2010,2009/07/01 00:00:00.000,2010/12/31 00:00:00.000,EM EXECUÇÃO,EXTERNO,Pesquisa Tecnológica,125,departamento de informática e matemática aplicada,2538276.0,RICARDO PEZZUOL JACOBI,,,,sistemas integrados e distribuidos,hardware,
2382939,PIB5179-2010,Desenvolvimento de um Jogo de Estratégia para o Ensino de Engenharia de Software,"ensino aprendizagem de engenharia de software, jogos de estratégia",2382937,2010,2010/08/01 00:00:00.000,2011/07/31 00:00:00.000,EM EXECUÇÃO,INTERNO,Pesquisa Científica,125,departamento de informática e matemática aplicada,,,(2010) EDITAL 01/2010 - PIBIC-PIBICAA-PIBITI,,,engenharia de software;teoria dos grafos;sistemas de apoio à decisão;otimização,engenharia de software,
2403989,PIB5292-2010,Estudo de métodos orientados a metas para engenharia de requisitos,"engenharia de requisitos, métodos orientados a metas, modelagem de requisitos",2403961,2010,2010/08/01 00:00:00.000,2011/07/31 00:00:00.000,EM EXECUÇÃO,INTERNO,Pesquisa Científica,125,departamento de informática e matemática aplicada,,,(2010) EDITAL 01/2010 - PIBIC-PIBICAA-PIBITI,,,engenharia de software experimental,engenharia de software,
2433071,PIB5455-2010,Uma Abordagem de Mapeamento de Modelos de Requisitos para Modelos Arquiteturais através de MDD,"engenharia de requisitos, arquitetura de software, mdd",2433069,2010,2010/07/01 00:00:00.000,2011/07/01 00:00:00.000,FINALIZADO,EXTERNO,Pesquisa Científica,125,departamento de informática e matemática aplicada,,,,,,engenharia de requisitos,engenharia de software,
2441118,PIB5482-2010,Técnicas Avançadas de Aprendizado de Máquina (Edital CGCI Nr. 009/2008 - CAPES-FCT),"aprendizado de máquina, sistemas inteligentes híbridos",2441116,2010,2009/07/01 00:00:00.000,2010/12/31 00:00:00.000,EM EXECUÇÃO,EXTERNO,Pesquisa Científica,125,departamento de informática e matemática aplicada,2441141.0,ANDRÉ CARLOS PONCE DE LEON FERREIRA DE CARVALHO,,,,processamento gráfico e inteligência computacional,software básico,
2441178,PIB5483-2010,Sistemas Híbridos de Aprendizado de Maquina (CAPES - PROCAD),"aprendizado de máquina, sistemas inteligentes híbridos",2441168,2010,2008/11/01 00:00:00.000,2012/10/31 00:00:00.000,EM EXECUÇÃO,EXTERNO,Pesquisa Científica,125,departamento de informática e matemática aplicada,2441175.0,ANDRÉ CARLOS PONCE DE LEON FERREIRA DE CARVALHO,,,,processamento gráfico e inteligência computacional,software básico,
2441189,PIB5484-2010,Desenvolvimento de Sistemas Híbridos Inteligentes - Programa de Apoio a Núcleos de Excelência - PRONEX,"aprendizado de máquina, sistemas inteligentes híbridos",2441182,2010,2008/06/01 00:00:00.000,2010/12/31 00:00:00.000,EM EXECUÇÃO,EXTERNO,Pesquisa Científica,125,departamento de informática e matemática aplicada,2441143.0,TERESA BERNARDA LUDERMIR,,,,processamento gráfico e inteligência computacional,software básico,
2534640,PIB5516-2010,Modelagem e Otimização de Processadores em Sistemas Multiprocessados baseados em Redes-em-Chip,projeto de sistemas embarcados; processadores,2534636,2010,2010/05/10 00:00:00.000,2012/05/09 00:00:00.000,FINALIZADO,EXTERNO,Pesquisa Científica,125,departamento de informática e matemática aplicada,,,,,,"microeletrônica, sistemas ubíquos, sistemas embarcados",hardware,
2538630,PIB5518-2010,Meta-Aprendizado: Algoritmos de Agrupamento e Análise de Base de Dados de Expressão Gênica ,"análise de agrupamentos, meta-aprendizado, bioinfomática",2538620,2010,2008/01/01 00:00:00.000,2010/01/01 00:00:00.000,EM EXECUÇÃO,EXTERNO,Pesquisa Científica,125,departamento de informática e matemática aplicada,,,,,,processamento gráfico e inteligência computacional,arquitetura de sistemas de computação,
2538642,PIB5519-2010,Sistemas Híbridos de Aprendizado de Maquina (CAPES - PROCAD) ,"sistemas híbridos inteligentes, aprendizado de máquina",2538633,2010,2008/11/01 00:00:00.000,2011/10/30 00:00:00.000,EM EXECUÇÃO,EXTERNO,Pesquisa Científica,125,departamento de informática e matemática aplicada,,,,,,processamento gráfico e inteligência computacional,arquitetura de sistemas de computação,
2538662,PIB5520-2010,Técnicas Avançadas de Aprendizado de Máquina (Edital CGCI Nr. 009/2008 - CAPES-FCT),aprendizado de máquina,2538648,2010,2009/01/01 00:00:00.000,2010/12/31 00:00:00.000,EM EXECUÇÃO,EXTERNO,Pesquisa Científica,125,departamento de informática e matemática aplicada,2441175.0,ANDRÉ CARLOS PONCE DE LEON FERREIRA DE CARVALHO,,,,processamento gráfico e inteligência computacional,arquitetura de sistemas de computação,
94787041,PIB9068-2010,Establishing the Parameters of Soft Biometrics Integration in an Agent-Based Identification Framework,"biometrcis, soft-biometrics, identification, security, social networks envirolment, young people, id cards",91792467,2010,2010/09/01 00:00:00.000,2011/12/31 00:00:00.000,FINALIZADO,EXTERNO,Pesquisa Científica,125,departamento de informática e matemática aplicada,,,,,,gestão da informação,engenharia elétrica,
4849831,PIC6011-2010,Aspectos ergonômicos dos ambientes de Ponta Negra e análise do comportamento não-verbal da população masculina nas áreas de prostituição,"ergonomia, comportamento não-verbal",4849829,2010,2011/01/01 00:00:00.000,2011/12/31 00:00:00.000,FINALIZADO,INTERNO,Pesquisa Científica,139,departamento de artes,,,(2011) Edital 07/2010 - Distribuição de Bolsas IC e IT - PROPESQ e REUNI 2011,,,intermediação humano-ambiente,programação visual,
4867452,PIC6066-2010,"ESTUDO DA EFICIÊNCIA, EFICÁCIA E SATISFAÇÃO NA INTERAÇÃO COM ELEMENTOS DE INTERFACE GRÁFICA NA WEB SOB A ÓTICA DA USABILIDADE E DO DESIGN","interfaces,design, interação humano-computador",4867450,2010,2011/01/01 00:00:00.000,2011/12/31 00:00:00.000,RENOVADO,INTERNO,Pesquisa Científica,139,departamento de artes,,,(2011) Edital 07/2010 - Distribuição de Bolsas IC e IT - PROPESQ e REUNI 2011,,,ergonomia e interação humano-computador,programação visual,
2412196,PIF3141-2010,Suporte para reutilização de tecnologias e inclusão digital utilizando software livre,"software livre, inclusão digital",2412184,2010,2010/08/01 00:00:00.000,2011/07/31 00:00:00.000,RENOVADO,INTERNO,Pesquisa Científica,235,ceres - depto ciências exatas e aplicadas,,,,,,engenharia de software;teoria dos grafos;sistemas de apoio à decisão;otimização,metodologia e técnicas da computação,
5052863,PIF6435-2010,Medida da complexidade de autômatos finitos,"sistemas complexos, autômatos finitos",5052861,2010,2010/10/27 00:00:00.000,2011/07/29 00:00:00.000,EM EXECUÇÃO,EXTERNO,Pesquisa Científica,235,ceres - depto ciências exatas e aplicadas,,,,,,física da computação,física geral,
89828536,PIG10976-2010,Implementação de um Receptor UHF a 400 MHz a ser embarcado em satélite do SBCD.,"circuitos integrados cmos, receptor de uhf, sistemas embarcados espaciais.",89828512,2010,2010/11/11 00:00:00.000,2014/10/31 00:00:00.000,FINALIZADO,EXTERNO,Pesquisa Científica,112,departamento de engenharia elétrica,,,,,,microeletrônica,circuitos eletrônicos,
50908061,PIG11563-2010,Implementação de um Receptor UHF a 400 MHz a ser embarcado em satélite do SBCD.,"circuitos integrados cmos, receptor de uhf, sistemas embarcados espaciais.",50908059,2010,2010/11/11 00:00:00.000,2014/10/01 00:00:00.000,FINALIZADO,EXTERNO,Pesquisa Científica,112,departamento de engenharia elétrica,,,,,,microeletrônica,circuitos eletrônicos,
2353805,PIG3136-2010,Segmentação de Mercado Multi-Aspectos Através de Mapas Auto-Organizáveis ,"segmentação de mercado, mapas auto-organizáveis, redes neurais, agrupamento de dados, sistemas inteligentes",2353790,2010,2010/08/01 00:00:00.000,2011/07/31 00:00:00.000,EM EXECUÇÃO,INTERNO,Pesquisa Científica,112,departamento de engenharia elétrica,,,,,,sistemas inteligentes,sistemas de computação,
2094244,PIG4705-2010,ALGORITMO PARALELO UTILIZANDO A OTIMIZAÇÃO POR ENXAME DE PARTÍCULAS (PSO) NA RESOLUÇÃO DO PROBLEMA DE ATRIBUIÇÃO DE LOCALIDADES A ANÉIS EM REDES SONET/SDH,"otimização por enxame de partículas (pso), problema de atribuição de localidades a anéis em redes sonet/sdh, programação paralela",2094242,2010,2010/01/01 00:00:00.000,2010/12/31 00:00:00.000,EM EXECUÇÃO,INTERNO,Pesquisa Científica,105,programa de pós-graduação em engenharia de produção,,,(2010) EDITAL PROPESQ 02/2010,111.0,OTIMIZAÇÃO COMBINATÓRIA E DESENVOLVIMENTO DE SISTEMAS COMPUTACIONAIS DE APOIO À DECISÃO,pesquisa operacional; metaheurísticas,"programação linear, não-linear, mista e dinâmica",
4856414,PIG6025-2010,Seleção de Acesso para Redes 4G usando Estratégias de Computação Evolutiva,redes cooperativas 4g; computação evolutiva; seleção de acesso; mutli-acesso,4856408,2010,2011/01/01 00:00:00.000,2011/12/31 00:00:00.000,RENOVADO,INTERNO,Pesquisa Científica,5204,departamento de engenharia de comunicações,,,(2011) Edital 07/2010 - Distribuição de Bolsas IC e IT - PROPESQ e REUNI 2011,88682241.0,GppCom - Grupo de Pesquisa em Prototipagem Rápida de Soluções para Comunicação,gerência de recursos de rádio para sistemas de comunicações móveis,telecomunicações,
4871711,PIG6081-2010,e-Guia: Sistema para Prover Autonomia e Acessibilidade aos Deficientes Visuais nos Serviços de Transportes Urbanos,"tecnologias assistivas, deficiente visual, mobilidade urbana, autonomia",4871709,2010,2010/09/23 00:00:00.000,2013/10/23 00:00:00.000,FINALIZADO,EXTERNO,Pesquisa Tecnológica,5205,departamento de engenharia biomedica,,,,85199087.0,Laboratório de Inovação Tecnológica em Saúde,tecnologias assistivas e mobilidade urbana,arquitetura de sistemas de computação,
4887245,PIG6162-2010,Modelagem computacional de redes genéticas regulatórias,"modelagem computacional, bioinformática, sistemas complexos, redes genéticas regulatórias",4887243,2010,2011/01/01 00:00:00.000,2011/12/31 00:00:00.000,FINALIZADO,INTERNO,Pesquisa Científica,56,departamento de engenharia de computacao e automacao,,,(2011) Edital 07/2010 - Distribuição de Bolsas IC e IT - PROPESQ e REUNI 2011,,,modelagem computacional de sistemas complexos,sistemas de computação,
4923360,PIH6354-2010,Composição Baseada em Geração de SoundKits para o Hydrogen Drum Machine,música e computação; composição musical,4923358,2010,2010/10/01 00:00:00.000,2011/09/30 00:00:00.000,EM EXECUÇÃO,INTERNO,Pesquisa Tecnológica,351,escola agrícola de jundiaí,,,(2010) EDITAL PROPESQ 09-T/2010 - PIBIC-EM (ENSINO MÉDIO),96167500.0,BRAVO,teoria da criação artística,composição musical,
2397472,PIJ5264-2010,Produção de Objetos de Aprendizagem como Recurso Didático para o Ensino da Disciplina de Informática Fundamental na UFRN,"informática fundamental, objetos de aprendizagem, educação",2397470,2010,2010/08/01 00:00:00.000,2011/07/31 00:00:00.000,EM EXECUÇÃO,INTERNO,Pesquisa Científica,4885,escola de ciências e tecnologia,,,(2010) EDITAL 01/2010 - PIBIC-PIBICAA-PIBITI,,,ensino de ciências / tecnologia e desenvolvimento de protótipos educacionais,linguagens de programação,
2376604,PIL3121-2010,"PROJETO DE PESQUISA: CARACTERIZAÇÃO E MODELAGEM DOS SISTEMAS DE PRODUÇÃO DE RUMINANTES NOS MUNICÍPIOS DE MACAÍBA, SÃO GONÇALO DO AMARANTE, VERA CRUZ E MONTE ALEGRE",caprino; bovino; ovino; planejamento de sistema; programação linear,2376587,2010,2010/08/01 00:00:00.000,2011/07/31 00:00:00.000,FINALIZADO,INTERNO,Pesquisa Científica,3391,coordenação de pós-graduação do ensino das cnem,,,,,,modelagem de sistemas de de produção; programação linear aplicada as ciências agrárias ,criação de animais,
2398633,PVB2141-2010,AMEM-AOSD - AMbientE Baseado em Modelos para Desenvolvimento Orientado a Aspectos ,"desenvolvimento de sofware, orientação a aspectos, modelos",2398607,2010,2010/08/01 00:00:00.000,2011/07/31 00:00:00.000,RENOVADO,INTERNO,Pesquisa Científica,125,departamento de informática e matemática aplicada,,,,89.0,ConSiste: Concepção de Sistemas de Computação,arquitetura de software;engenharia de software;;,arquitetura de sistemas de computação,
2199511,PVB3004-2010,Desenvolvimento de Linhas de Produto de Software usando Aspectos e Modelos,"linhas de produto de software, desenvolvimento orientado a aspectos, desenvolvimento dirigido por modelos",2199489,2010,2010/03/16 00:00:00.000,2010/03/18 00:00:00.000,EM EXECUÇÃO,INTERNO,Pesquisa Científica,125,departamento de informática e matemática aplicada,,,,127151828.0,Collaborative & Automated Software Engineering,engenharia de linhas de produto de software,ciência da computação,
2177990,PVB3346-2010,"Algoritmos Experimentais na Solução dos Jogos Sudoku, Super-Soduko e Samurai
","algoritmos experimentais, jogos sudoku, metaheurística",2177977,2010,2010/08/01 00:00:00.000,2011/07/31 00:00:00.000,RENOVADO,INTERNO,Pesquisa Tecnológica,125,departamento de informática e matemática aplicada,,,,88.0,TEORIA DOS GRAFOS E ALGORITMOS,metaheurísticas;;;,arquitetura de sistemas de computação,
2378511,PVB3401-2010,MÉTODOS ALTERNATIVOS PARA ESTIMAÇÃO DE SUBREGISTRO DE NASCIMENTOS E ÓBITOS NO BRASIL,"sub-registro, óbitos, nascimentos, computação bayesiana",2378489,2010,2010/08/01 00:00:00.000,2011/07/31 00:00:00.000,RENOVADO,INTERNO,Pesquisa Científica,47,departamento de estatistica,,,,99.0,GRUPO DE ESTUDOS DEMOGRÁFICOS,demografia;saúde coletiva;população e saúde;,probabilidade e estatística,
4923025,PVB3462-2010,Otimização de redes em chip para atender QoS de aplicações de tempo real em sistemas embarcados.,"sistemas embarcados, redes em chip, qualidade de serviço, tempo real, microeletrônica.",4923006,2010,2010/10/01 00:00:00.000,2011/09/30 00:00:00.000,RENOVADO,INTERNO,Pesquisa Científica,125,departamento de informática e matemática aplicada,,,,89.0,ConSiste: Concepção de Sistemas de Computação,sistemas integrados e distribuidos,hardware,
4924483,PVB3462-2010,Otimização de redes em chip para atender QoS de aplicações de tempo real em sistemas embarcados.,"sistemas embarcados, redes em chip, qualidade de serviço, tempo real, microeletrônica.",4924464,2010,2010/10/01 00:00:00.000,2011/09/30 00:00:00.000,RENOVADO,INTERNO,Pesquisa Científica,125,departamento de informática e matemática aplicada,,,,89.0,ConSiste: Concepção de Sistemas de Computação,sistemas integrados e distribuidos,hardware,
2115280,PVB4794-2010,Aplicando Desenvolvimento Dirigido por testes Utilizando Ruby e o Framework Rails,"teste de software, ruby, desenvolvimento dirigido por testes",2115278,2010,2010/01/01 00:00:00.000,2010/12/31 00:00:00.000,FINALIZADO,INTERNO,Pesquisa Científica,125,departamento de informática e matemática aplicada,,,(2010) EDITAL PROPESQ 02/2010,89.0,ConSiste: Concepção de Sistemas de Computação,teste de software,engenharia de software,
2177815,PVB4813-2010,Algoritmos Metaheurísticos na Solução do Problema Flowshop de Permutação com critério Flowtime,"flowshop de permutação, metaheurísticas",2177813,2010,2010/08/01 00:00:00.000,2011/07/31 00:00:00.000,RENOVADO,INTERNO,Pesquisa Científica,125,departamento de informática e matemática aplicada,,,(2010) EDITAL 01/2010 - PIBIC-PIBICAA-PIBITI,88.0,TEORIA DOS GRAFOS E ALGORITMOS,meta-heurísticas,arquitetura de sistemas de computação,
2178226,PVB4815-2010,O Problema do Caixeiro Alugador: Modelos e Algoritmos de Solução,"problema do caixeiro alugador, roteamento, metaheurística",2178224,2010,2010/08/01 00:00:00.000,2011/07/31 00:00:00.000,RENOVADO,INTERNO,Pesquisa Científica,125,departamento de informática e matemática aplicada,,,(2010) EDITAL 01/2010 - PIBIC-PIBICAA-PIBITI,88.0,TEORIA DOS GRAFOS E ALGORITMOS,otimização combinatória,arquitetura de sistemas de computação,
2182407,PVB4820-2010,Ferramentas Estatísticas para Análise de Algoritmos Experimentais,"análise de algoritmos, otimização combinatória, estatística",2182401,2010,2010/08/01 00:00:00.000,2011/07/31 00:00:00.000,FINALIZADO,INTERNO,Pesquisa Científica,125,departamento de informática e matemática aplicada,,,(2010) EDITAL 01/2010 - PIBIC-PIBICAA-PIBITI,88.0,TEORIA DOS GRAFOS E ALGORITMOS,meta-heurísticas,arquitetura de sistemas de computação,
2182984,PVB4821-2010,Algoritmos Experimentais Aplicados a Problemas Reais com Modelos em Otimização Combinatória,"problemas de otimização combinatória, algoritmos evolucionários, distribuição de derivados de petróleo, problemas em redes, problemas de roteamento.",2182982,2010,2010/08/01 00:00:00.000,2011/07/31 00:00:00.000,RENOVADO,INTERNO,Pesquisa Científica,125,departamento de informática e matemática aplicada,,,(2010) EDITAL 01/2010 - PIBIC-PIBICAA-PIBITI,88.0,TEORIA DOS GRAFOS E ALGORITMOS,meta-heurísticas,arquitetura de sistemas de computação,
2220908,PVB4873-2010,DIAGNÓSTICO E MONITORAMENTO DA QUALIDADE DA ÁGUA E DOS  SEDIMENTOS DAS ÁREAS CIRCUNVIZINHAS AO TERMINAL SALINEIRO DE AREIA BRANCA (TERMISA),"monitoramento, água, sedimento, paramentro fisico-quimicos",2220906,2010,2010/04/01 00:00:00.000,2012/04/01 00:00:00.000,RENOVADO,EXTERNO,Pesquisa Tecnológica,4663,ccet - núcleo de estudos em petróleo e gás natural,,,,83.0,ELETROQUÍMICA E CORROSÃO,análise de traço e química ambiente,análise de traços e química ambiental,
